{
    "$schema":  "../../schemas/patch_recipe.schema.json",
    "schema_type":  "PatchRecipe",
    "schema_version":  1,
    "enabled":  true,
    "id":  "json_patch_v10_st_ld",
    "display_name":  "json_patch v10 for ST GNU ld",
    "description":  "Applies the internal 13.3 json_patch payload package into src/binutils/ld by copying the implementation files and inserting the documented glue fragments.",
    "status":  "verified_local",
    "supported_families":  [
                               "st-gnu-tools-for-stm32"
                           ],
    "patch_package":  {
                          "id":  "json_patch_v10_package",
                          "root_hint":  "payloads/json_patch_v10_st_ld_13_3_rel1_20250523_0900",
                          "required_files":  [
                                                 "ldjson_options.def",
                                                 "ldjson_compat.h",
                                                 "ldscript_json_impl.inc",
                                                 "hooks/ld.h.fragment",
                                                 "hooks/ldlex.h.fragment",
                                                 "hooks/lexsup_options.fragment",
                                                 "hooks/lexsup_switch.fragment",
                                                 "hooks/ldlang_include.fragment",
                                                 "hooks/ldlang_runtime.fragment",
                                                 "hooks/pex-win32.fragment",
                                                 "hooks/Makefile.am.fragment"
                                             ]
                      },
    "required_files":  [
                           "src/binutils/ld/ld.h",
                           "src/binutils/ld/ldlex.h",
                           "src/binutils/ld/lexsup.c",
                           "src/binutils/ld/ldlang.c",
                           "src/binutils/ld/Makefile.am",
                           "src/binutils/libiberty/pex-win32.c"
                       ],
    "optional_files":  [
                           "src/binutils/ld/Makefile.in"
                       ],
    "applicability_checks":  [
                                 {
                                     "type":  "file_exists",
                                     "path":  "src/binutils/ld/ld.h",
                                     "blocking":  true,
                                     "description":  "ld.h exists"
                                 },
                                 {
                                     "type":  "file_exists",
                                     "path":  "src/binutils/ld/ldlex.h",
                                     "blocking":  true,
                                     "description":  "ldlex.h exists"
                                 },
                                 {
                                     "type":  "file_exists",
                                     "path":  "src/binutils/ld/lexsup.c",
                                     "blocking":  true,
                                     "description":  "lexsup.c exists"
                                 },
                                 {
                                     "type":  "file_exists",
                                     "path":  "src/binutils/ld/ldlang.c",
                                     "blocking":  true,
                                     "description":  "ldlang.c exists"
                                 },
                                 {
                                     "type":  "file_exists",
                                     "path":  "src/binutils/ld/Makefile.am",
                                     "blocking":  true,
                                     "description":  "Makefile.am exists"
                                 },
                                 {
                                     "type":  "file_exists",
                                     "path":  "src/binutils/libiberty/pex-win32.c",
                                     "blocking":  true,
                                     "description":  "pex-win32.c exists"
                                 },
                                 {
                                     "type":  "regex_present",
                                     "path":  "src/binutils/ld/ld.h",
                                     "regex":  "char \\*default_script;",
                                     "expected_count":  1,
                                     "blocking":  true,
                                     "description":  "args_type contains the default_script anchor"
                                 },
                                 {
                                     "type":  "regex_present",
                                     "path":  "src/binutils/ld/ldlex.h",
                                     "regex":  "OPTION_DEFAULT_SCRIPT,",
                                     "expected_count":  1,
                                     "blocking":  true,
                                     "description":  "option_values contains the default script anchor"
                                 },
                                 {
                                     "type":  "regex_present",
                                     "path":  "src/binutils/ld/lexsup.c",
                                     "regex":  "\\{\"dT\", required_argument, NULL, OPTION_DEFAULT_SCRIPT\\},\\s*'\\\\0', NULL, NULL, ONE_DASH \\},",
                                     "expected_count":  1,
                                     "blocking":  true,
                                     "description":  "ld_options[] contains the default-script row anchor"
                                 },
                                 {
                                     "type":  "regex_present",
                                     "path":  "src/binutils/ld/lexsup.c",
                                     "regex":  "case OPTION_DEFAULT_SCRIPT:",
                                     "expected_count":  1,
                                     "blocking":  true,
                                     "description":  "parse_args() contains the OPTION_DEFAULT_SCRIPT case anchor"
                                 },
                                 {
                                     "type":  "regex_present",
                                     "path":  "src/binutils/ld/ldlang.c",
                                     "regex":  "print_statement_list \\(statement_list\\.head, abs_output_section\\);",
                                     "expected_count":  1,
                                     "blocking":  true,
                                     "description":  "ldlang.c contains the print_statements() include anchor"
                                 },
                                 {
                                     "type":  "regex_present",
                                     "path":  "src/binutils/ld/ldlang.c",
                                     "regex":  "ldlang_check_require_defined_symbols \\(\\);\\s*lang_end \\(\\);",
                                     "expected_count":  1,
                                     "blocking":  true,
                                     "description":  "ldlang.c contains the finalized lang_process() runtime-call anchor"
                                 }
                             ],
    "operations":  [
                       {
                           "type":  "copy_file",
                           "target_path":  "src/binutils/ld/ldjson_options.def",
                           "source_path":  "ldjson_options.def",
                           "description":  "Copy the X-macro option definition file"
                       },
                       {
                           "type":  "copy_file",
                           "target_path":  "src/binutils/ld/ldjson_compat.h",
                           "source_path":  "ldjson_compat.h",
                           "description":  "Copy the portability and format metadata header"
                       },
                       {
                           "type":  "copy_file",
                           "target_path":  "src/binutils/ld/ldscript_json_impl.inc",
                           "source_path":  "ldscript_json_impl.inc",
                           "description":  "Copy the standalone linker JSON implementation block"
                       },
                       {
                           "type":  "insert_after_regex",
                           "target_path":  "src/binutils/ld/ld.h",
                           "source_path":  "hooks/ld.h.fragment",
                           "match_regex":  "char \\*default_script;",
                           "insert_mode":  "after",
                           "expected_match_count":  1,
                           "description":  "Expand args_type fields from ldjson_options.def"
                       },
                       {
                           "type":  "insert_after_regex",
                           "target_path":  "src/binutils/ld/ldlex.h",
                           "source_path":  "hooks/ldlex.h.fragment",
                           "match_regex":  "OPTION_DEFAULT_SCRIPT,",
                           "insert_mode":  "after",
                           "expected_match_count":  1,
                           "description":  "Expand option_values enum rows from ldjson_options.def"
                       },
                       {
                           "type":  "insert_after_regex",
                           "target_path":  "src/binutils/ld/lexsup.c",
                           "source_path":  "hooks/lexsup_options.fragment",
                           "match_regex":  "\\{\"dT\", required_argument, NULL, OPTION_DEFAULT_SCRIPT\\},\\s*'\\\\0', NULL, NULL, ONE_DASH \\},",
                           "insert_mode":  "after",